{
  "$schema": "/metadata/class-schema.json",
  "class": "Item",
  "parent": "DataObject",
  "description": "Item in order",
  "jsonPath": "$.items[*]",
  "fields": [
    { "name": "id", "jsonPath": "$.id", "type": "string" },
    { "name": "sku", "jsonPath": "$.sku", "type": "string", "nullable": true },
    { "name": "price", "jsonPath": "$.price", "type": "decimal", "nullable": true }
  ]
}
