{
  "class": "ApprovalDecision",
  "parent": "DataObject",
  "description": "Decision result from approval flow",
  "jsonPath": "$.approvalDecision",
  "fields": [
    { "name": "status", "jsonPath": "$.status", "type": "string" },
    { "name": "reason", "jsonPath": "$.reason", "type": "string" }
  ]
}
